{
  "schemaVersion": 1,
  "protocolVersion": 1,
  "taskId": "TASK-007",
  "status": "READY",
  "profile": {
    "languages": [
      "typescript"
    ],
    "framework": "vite-react",
    "packageManager": "npm"
  },
  "contract": {
    "fingerprint": "e758ea72bdd18924d46fbd43631bbdffabe7256115b8f4069c7b50dd1f7f3274",
    "objectivePresent": true
  },
  "routing": {
    "primary": "implementation",
    "guidesSelected": true
  },
  "requiredGates": [
    "unit-tests"
  ],
  "satisfiedGates": [],
  "errors": []
}
